{
 "artifact_id": "TIBER_IDENTITY_CROSSWALK_V2",
 "schema_version": "v2",
 "generated_at": "2026-09-13T12:59:02Z",
 "supported_providers": [
  "sleeper"
 ],
 "coverage": "operator_promoted_slice_gsis_vocabulary_not_full_player_universe",
 "id_vocabulary": "gsis",
 "coverage_notes": {
  "id_vocabulary": "tiber_player_id is a GSIS player id (00-XXXXXXX), matching TIBER-FORGE FORGE_PLAYER_STATIC_V1 promoted rows.",
  "slice": "Rows backing the pinned FORGE cohort, plus prior promoted provider ids re-expressed in the GSIS vocabulary. Plus four operator-accepted Draft Review identities; see admission receipt. Plus three operator-authorized historical Team identities prepared on the review branch; see separate Team admission receipt. Production and consumer activation remain separately gated. Plus nineteen operator-accepted historical Team identities; see team_roster_identity_admission_v1. Branch and consumer preparation only; no merge or production release.",
  "match_method": "gsis_direct/espn_bridge are provider-declared id agreements; name_exact is a unique normalized-name + position match and carries medium confidence."
 },
 "source_artifacts": [
  {
   "artifact": "IDENTITY_CROSSWALK_CANDIDATES_V0",
   "path": "exports/candidates/identity_crosswalk/identity_crosswalk_candidates_v0.json",
   "sha256": "45a69f2176104249d3ea416ccdd71dadd8196c6f5dfe3f1bf4e303580ecf47cd"
  },
  {
   "artifact": "FORGE_PLAYER_STATIC_V1",
   "path": "TIBER-FORGE:exports/promoted/forge_player_static/forge_player_static_v1.json",
   "sha256": "de0e2c19a7054653c460b9b8597b620d37084b5407d035afb97310c694cd1cf9"
  },
  {
   "artifact": "DRAFT_REVIEW_EVIDENCE_ADMISSION_V1",
   "path": "exports/promoted/draft_review/evidence_admission_v1.json",
   "sha256": "603e52409c5d07820bc58c5c0b7d6df91e4eb7cdc31326633d1c24e35c34811c"
  },
  {
   "artifact": "TEAM_IDENTITY_ADMISSION_V1",
   "path": "exports/promoted/draft_review/team_identity_admission_v1.json",
   "sha256": "4ed7a6e7d0310c0f3b3e3c70a53f7d7ec0fb0c22dbd931702ea5efc4399f84ef"
  },
  {
   "artifact": "TEAM_ROSTER_IDENTITY_ADMISSION_V1",
   "path": "exports/promoted/draft_review/team_roster_identity_admission_v1.json",
   "sha256": "cc61d1e236138e1c1e6685fb444c3db81da1188d7cfcc895b278164916e9be4f"
  }
 ],
 "record_count": 94,
 "record_count_by_match_method": {
  "espn_bridge": 8,
  "gsis_direct": 26,
  "name_exact": 60
 },
 "records": [
  {
   "provider": "sleeper",
   "provider_player_id": "96",
   "provider_canonical_id": "sleeper:96",
   "tiber_player_id": "00-0023459",
   "player_name": "Aaron Rodgers",
   "position": "QB",
   "team": "PIT",
   "confidence": "high",
   "match_method": "gsis_direct",
   "source": "exports/candidates/identity_crosswalk/identity_crosswalk_candidates_v0.json",
   "source_updated_at": "2026-08-09T00:00:00Z"
  },
  {
   "provider": "sleeper",
   "provider_player_id": "421",
   "provider_canonical_id": "sleeper:421",
   "tiber_player_id": "00-0026498",
   "player_name": "Matthew Stafford",
   "position": "QB",
   "team": "LAR",
   "confidence": "high",
   "match_method": "gsis_direct",
   "source": "exports/candidates/identity_crosswalk/identity_crosswalk_candidates_v0.json",
   "source_updated_at": "2026-08-09T00:00:00Z"
  },
  {
   "provider": "sleeper",
   "provider_player_id": "2133",
   "provider_canonical_id": "sleeper:2133",
   "tiber_player_id": "00-0031381",
   "player_name": "Davante Adams",
   "position": "WR",
   "team": "LAR",
   "confidence": "high",
   "match_method": "gsis_direct",
   "source": "exports/candidates/identity_crosswalk/identity_crosswalk_candidates_v0.json",
   "source_updated_at": "2026-08-09T00:00:00Z"
  },
  {
   "provider": "sleeper",
   "provider_player_id": "2216",
   "provider_canonical_id": "sleeper:2216",
   "tiber_player_id": "00-0031408",
   "player_name": "Mike Evans",
   "position": "WR",
   "team": "SF",
   "confidence": "high",
   "match_method": "gsis_direct",
   "source": "exports/candidates/identity_crosswalk/identity_crosswalk_candidates_v0.json",
   "source_updated_at": "2026-08-09T00:00:00Z"
  },
  {
   "provider": "sleeper",
   "provider_player_id": "2306",
   "provider_canonical_id": "sleeper:2306",
   "tiber_player_id": "00-0031503",
   "player_name": "Jameis Winston",
   "position": "QB",
   "team": "NYG",
   "confidence": "high",
   "match_method": "gsis_direct",
   "source": "exports/candidates/identity_crosswalk/identity_crosswalk_candidates_v0.json",
   "source_updated_at": "2026-08-09T00:00:00Z"
  },
  {
   "provider": "sleeper",
   "provider_player_id": "3198",
   "provider_canonical_id": "sleeper:3198",
   "tiber_player_id": "00-0032764",
   "player_name": "Derrick Henry",
   "position": "RB",
   "team": "BAL",
   "confidence": "high",
   "match_method": "gsis_direct",
   "source": "exports/candidates/identity_crosswalk/identity_crosswalk_candidates_v0.json",
   "source_updated_at": "2026-08-09T00:00:00Z"
  },
  {
   "provider": "sleeper",
   "provider_player_id": "3321",
   "provider_canonical_id": "sleeper:3321",
   "tiber_player_id": "00-0033040",
   "player_name": "Tyreek Hill",
   "position": "WR",
   "team": null,
   "confidence": "high",
   "match_method": "gsis_direct",
   "source": "exports/candidates/identity_crosswalk/identity_crosswalk_candidates_v0.json",
   "source_updated_at": "2026-08-09T00:00:00Z"
  },
  {
   "provider": "sleeper",
   "provider_player_id": "3294",
   "provider_canonical_id": "sleeper:3294",
   "tiber_player_id": "00-0033077",
   "player_name": "Dak Prescott",
   "position": "QB",
   "team": "DAL",
   "confidence": "high",
   "match_method": "gsis_direct",
   "source": "exports/candidates/identity_crosswalk/identity_crosswalk_candidates_v0.json",
   "source_updated_at": "2026-08-09T00:00:00Z"
  },
  {
   "provider": "sleeper",
   "provider_player_id": "3163",
   "provider_canonical_id": "sleeper:3163",
   "tiber_player_id": "00-0033106",
   "player_name": "Jared Goff",
   "position": "QB",
   "team": "DET",
   "confidence": "high",
   "match_method": "gsis_direct",
   "source": "exports/candidates/identity_crosswalk/identity_crosswalk_candidates_v0.json",
   "source_updated_at": "2026-08-09T00:00:00Z"
  },
  {
   "provider": "sleeper",
   "provider_player_id": "3257",
   "provider_canonical_id": "sleeper:3257",
   "tiber_player_id": "00-0033119",
   "player_name": "Jacoby Brissett",
   "position": "QB",
   "team": "ARI",
   "confidence": "high",
   "match_method": "gsis_direct",
   "source": "exports/candidates/identity_crosswalk/identity_crosswalk_candidates_v0.json",
   "source_updated_at": "2026-08-09T00:00:00Z"
  },
  {
   "provider": "sleeper",
   "provider_player_id": "4034",
   "provider_canonical_id": "sleeper:4034",
   "tiber_player_id": "00-0033280",
   "player_name": "Christian McCaffrey",
   "position": "RB",
   "team": "SF",
   "confidence": "high",
   "match_method": "gsis_direct",
   "source": "exports/candidates/identity_crosswalk/identity_crosswalk_candidates_v0.json",
   "source_updated_at": "2026-08-09T00:00:00Z"
  },
  {
   "provider": "sleeper",
   "provider_player_id": "4454",
   "provider_canonical_id": "sleeper:4454",
   "tiber_player_id": "00-0033307",
   "player_name": "Kendrick Bourne",
   "position": "WR",
   "team": "ARI",
   "confidence": "high",
   "match_method": "gsis_direct",
   "source": "exports/candidates/identity_crosswalk/identity_crosswalk_candidates_v0.json",
   "source_updated_at": "2026-08-09T00:00:00Z"
  },
  {
   "provider": "sleeper",
   "provider_player_id": "4046",
   "provider_canonical_id": "sleeper:4046",
   "tiber_player_id": "00-0033873",
   "player_name": "Patrick Mahomes",
   "position": "QB",
   "team": "KC",
   "confidence": "high",
   "match_method": "gsis_direct",
   "source": "exports/candidates/identity_crosswalk/identity_crosswalk_candidates_v0.json",
   "source_updated_at": "2026-08-09T00:00:00Z"
  },
  {
   "provider": "sleeper",
   "provider_player_id": "5012",
   "provider_canonical_id": "sleeper:5012",
   "tiber_player_id": "00-0034753",
   "player_name": "Mark Andrews",
   "position": "TE",
   "team": "BAL",
   "confidence": "high",
   "match_method": "gsis_direct",
   "source": "exports/candidates/identity_crosswalk/identity_crosswalk_candidates_v0.json",
   "source_updated_at": "2026-08-09T00:00:00Z"
  },
  {
   "provider": "sleeper",
   "provider_player_id": "4866",
   "provider_canonical_id": "sleeper:4866",
   "tiber_player_id": "00-0034844",
   "player_name": "Saquon Barkley",
   "position": "RB",
   "team": "PHI",
   "confidence": "high",
   "match_method": "gsis_direct",
   "source": "exports/candidates/identity_crosswalk/identity_crosswalk_candidates_v0.json",
   "source_updated_at": "2026-08-09T00:00:00Z"
  },
  {
   "provider": "sleeper",
   "provider_player_id": "4892",
   "provider_canonical_id": "sleeper:4892",
   "tiber_player_id": "00-0034855",
   "player_name": "Baker Mayfield",
   "position": "QB",
   "team": "TB",
   "confidence": "high",
   "match_method": "gsis_direct",
   "source": "exports/candidates/identity_crosswalk/identity_crosswalk_candidates_v0.json",
   "source_updated_at": "2026-08-09T00:00:00Z"
  },
  {
   "provider": "sleeper",
   "provider_player_id": "4984",
   "provider_canonical_id": "sleeper:4984",
   "tiber_player_id": "00-0034857",
   "player_name": "Josh Allen",
   "position": "QB",
   "team": "BUF",
   "confidence": "high",
   "match_method": "gsis_direct",
   "source": "exports/candidates/identity_crosswalk/identity_crosswalk_candidates_v0.json",
   "source_updated_at": "2026-08-09T00:00:00Z"
  },
  {
   "provider": "sleeper",
   "provider_player_id": "4943",
   "provider_canonical_id": "sleeper:4943",
   "tiber_player_id": "00-0034869",
   "player_name": "Sam Darnold",
   "position": "QB",
   "team": "SEA",
   "confidence": "high",
   "match_method": "gsis_direct",
   "source": "exports/candidates/identity_crosswalk/identity_crosswalk_candidates_v0.json",
   "source_updated_at": "2026-08-09T00:00:00Z"
  },
  {
   "provider": "sleeper",